Clock,UR2+ DR1+ DL6+ UL1+ U6+ R1+ D4- L4+ ALL3+ y2 U3+ R5- D3+ L5- ALL4+ UR,UR5+ DR6+ DL0+ UL4+ U2+ R1+ D0+ L4- ALL4- y2 U2- R5- D6+ L2- ALL3+ UR UL,UR5+ DR2- DL4+ UL5+ U2- R4+ D3- L0+ ALL1- y2 U2- R1+ D5- L0+ ALL4- UR DR DL UL,UR6+ DR2+ DL0+ UL2- U3+ R1- D2- L4- ALL3- y2 U4- R5- D1- L4- ALL0+ UL,UR3+ DR3+ DL4- UL3+ U4- R6+ D1+ L3- ALL5- y2 U3+ R4- D0+ L4- ALL3- UR DR DL
Mirror3x3,B2 R2 B2 L2 F2 U' B2 D B2 U2 L2 F R2 D L2 U' L B' R2 U',U2 B2 D2 U B2 U' R2 D B2 R U B' R2 D' L2 U2 B F U' R',B2 D2 B2 R2 U' R2 D B2 R2 B2 U' B' L U R2 B' L U2 R',D' L2 F2 L2 F2 D' R2 U2 F2 L B' U F U R B2 D' U2 B2 U',F D2 B' U2 R2 B2 L2 U2 L2 D' B' R U B L' R B' L2 R D
Floppy,L2 F2 R2 L2 B2 L2 R2 F2 L2 B2 L2 B2 L2 B2 L2 ,B2 R2 F2 R2 B2 L2 F2 B2 R2 L2 F2 B2 R2 B2 L2 ,B2 R2 B2 L2 F2 R2 B2 R2 B2 R2 B2 R2 B2 R2 F2 ,L2 F2 L2 B2 F2 L2 F2 B2 L2 B2 L2 B2 L2 B2 R2 ,B2 R2 L2 B2 R2 B2 L2 F2 L2 B2 L2 F2 R2 L2 F2 
SuperFloppy,B F R2 B2 F2 R F R L2 B2 F' L2 R' F' R2 F' R2 L F' L' ,B' F' R2 B2 R2 F2 R' B L2 F2 B L2 B R' F' B L2 F2 R' F2 ,F2 L' B' R L' B2 L B' L B L F B2 L' F B R' B2 L2 R ,R L B L2 R B L F R' L B' F L B F R B2 L F2 B ,R' L2 B2 L' R' B L2 B L2 R F2 L F' B R' L F' L B2 L 
FloppyGhost,UL2 DL2 DR2 DL2 U2 UL2 U2 DR2 DL2 U2 UL2 DR2 UL2 DR2 UL2 DL2 DR2 U2 UL2 DR2 ,DR2 U2 UL2 DR2 UL2 DR2 U2 DL2 DR2 DL2 UL2 U2 DR2 UL2 DL2 U2 UL2 DR2 U2 DL2 ,DL2 U2 UL2 DR2 DL2 U2 UL2 DL2 DR2 U2 DL2 DR2 U2 DL2 U2 UL2 DL2 U2 UL2 DL2 ,DR2 DL2 U2 DR2 U2 DL2 U2 DR2 UL2 DL2 U2 DL2 UL2 DR2 U2 DL2 U2 U2 DR2 UL2 ,U2 DR2 UL2 DL2 DR2 UL2 DL2 DR2 UL2 DL2 DR2 U2 UL2 DL2 DR2 U2 UL2 DL2 U2 DR2 
Void,D2 B2 R F2 R' B2 L' B2 F2 D R U2 F2 L U2 F' U' L D' L2 Fw' Uw2,B F L2 B' U2 B' L2 D2 R2 B2 L' U R2 B' D' R B' F' R D2,D B2 L2 F2 R2 D U2 L' D B R' B R B' L R' B U Rw Uw2,F2 D2 U2 B' L2 B2 L2 U2 B' R' U F D' U2 R D F' U2 B F2 Rw' Uw',L U F' D' B' D R2 U F U' R' B2 D2 F2 D2 L2 F2 L D2 R
Kilominx,R++ D-- R-- D-- R-- D-- R-- D++ R++ D++ U / R++ D++ R++ D++ R-- D-- R++ D-- R++ D++ U' / R-- D++ R-- D++ R-- D-- R-- D-- R-- D++ U',R-- D++ R++ D-- R-- D-- R-- D-- R++ D-- U' / R++ D-- R-- D-- R++ D++ R-- D-- R++ D++ U' / R-- D-- R++ D++ R-- D-- R++ D-- R-- D-- U',R-- D++ R++ D++ R-- D-- R++ D-- R++ D-- U' / R++ D++ R++ D-- R-- D-- R-- D-- R-- D-- U' / R-- D++ R++ D++ R-- D++ R++ D++ R-- D++ U,R-- D++ R++ D++ R++ D-- R++ D-- R-- D++ U / R++ D++ R-- D++ R-- D++ R++ D-- R-- D++ U' / R-- D++ R-- D++ R-- D-- R++ D++ R++ D++ U',R-- D-- R-- D-- R++ D-- R++ D++ R-- D++ U / R-- D++ R-- D-- R++ D++ R-- D++ R++ D++ U / R++ D-- R++ D++ R++ D-- R++ D-- R-- D++ U
