Clock,UR5- DR4+ DL4+ UL2- U4+ R3- D3+ L3- ALL5+ y2 U4- R2+ D1- L2- ALL4- UR DR DL,UR3+ DR5+ DL2+ UL3+ U6+ R5- D1+ L6+ ALL1+ y2 U4- R1+ D2- L5+ ALL6+ UR DR,UR5+ DR5+ DL1+ UL5- U5- R6+ D5- L4- ALL3- y2 U4+ R0+ D4- L5- ALL0+ DR DL,UR4+ DR3- DL2- UL1+ U1+ R4- D4+ L4+ ALL1- y2 U0+ R4+ D4- L5- ALL3- UR UL,UR4- DR1- DL0+ UL3- U1- R1- D5- L0+ ALL0+ y2 U0+ R3+ D0+ L4+ ALL1+ UR DL
Mirror3x3,U2 B2 F2 D R2 D F2 L2 R2 U L B2 R F' L U L2 R D' U',D U B2 L2 D' R2 U2 B' L' R' B2 R2 F' D B U L U',R U2 L' U2 F2 D2 L2 F2 L' U2 R D B' R' F R' U L' F' D' R,U2 R2 D' B2 U2 R2 U' B2 D2 R2 F2 L' U F L2 U2 F' D' F' U,R2 U2 B' F2 R2 D2 B' L2 U2 F2 L U' L2 F D2 F2 L2 R' D B2 U2
Floppy,R2 B2 R2 L2 F2 L2 B2 L2 B2 R2 B2 F2 L2 R2 F2 ,R2 B2 R2 B2 R2 F2 L2 B2 F2 R2 F2 B2 R2 F2 B2 ,F2 R2 B2 L2 B2 F2 L2 R2 B2 L2 R2 F2 B2 L2 F2 ,R2 B2 L2 B2 F2 L2 R2 B2 L2 R2 F2 R2 L2 F2 L2 ,B2 L2 F2 B2 L2 B2 F2 L2 R2 F2 L2 F2 B2 L2 F2 
SuperFloppy,L B L' R B2 R F' B2 R2 F R2 F2 B2 L' B' L2 B F2 L' B' ,R2 B2 L2 R F' R B L' R' F' B L' R F L' B' R' B' F L ,B F' R F' L' F' L' R' F2 B' L' F L2 R B' R B2 F R L ,B2 F R2 L F2 R' L2 B2 F R2 B2 R F2 B L' B' L B R2 F2 ,L B' F2 R' F' R2 B2 R L' F' L R2 B2 L' F B' L' F L2 F2 
FloppyGhost,UR2 DL2 U2 DR2 DL2 UR2 DR2 DL2 UL2 U2 DR2 DL2 UL2 DR2 DL2 UR2 U2 DR2 DL2 DR2 ,UR2 UL2 DL2 DR2 UR2 UL2 DL2 U2 DR2 DL2 UR2 U2 DR2 UR2 DL2 DR2 UR2 DR2 U2 UL2 ,DR2 DL2 UL2 UR2 DL2 UL2 DL2 U2 DR2 UR2 UL2 DL2 UL2 DL2 DR2 UL2 DL2 UR2 DR2 UL2 ,DL2 U2 DR2 DL2 UL2 U2 DL2 UL2 DR2 UR2 DR2 U2 DL2 DR2 UL2 U2 UR2 U2 UR2 DL2 ,DR2 U2 DL2 UL2 U2 DL2 UR2 U2 DR2 UR2 DL2 DR2 U2 UL2 U2 DL2 UR2 DR2 U2 UL2 
Void,F U2 R2 U2 B' F' U2 B U2 R' D F2 D' B' L F L' R' D2 Rw,L2 U2 F2 U' L2 D L2 U' B2 U L2 B' R U L F' U2 L' D U' R' Fw',U F2 U2 F2 R2 D' R2 D' R2 B2 U' R' F2 D2 L' U' F L2 B F' U Rw Uw,D2 B2 U2 L2 F2 R F2 R' U2 B2 L2 B L2 R2 U F L F L' F2 L Fw' Uw',U R2 B2 D U2 R2 D' F2 U' B2 D' F' R2 U L F2 L B' D R' F Uw2
Kilominx,R-- D-- R-- D++ R-- D-- R-- D++ R++ D-- U / R++ D++ R++ D++ R-- D++ R-- D-- R-- D++ U' / R++ D-- R++ D-- R-- D-- R-- D-- R-- D++ U',R-- D++ R++ D++ R-- D++ R-- D-- R++ D-- U' / R++ D++ R++ D-- R++ D++ R-- D++ R-- D-- U / R-- D++ R++ D-- R-- D++ R-- D-- R++ D++ U,R++ D-- R-- D++ R++ D-- R++ D-- R++ D++ U / R++ D++ R++ D++ R++ D++ R++ D++ R-- D-- U' / R++ D-- R-- D++ R-- D++ R-- D-- R++ D-- U,R++ D++ R-- D++ R++ D++ R++ D++ R++ D-- U / R++ D-- R++ D-- R-- D++ R-- D++ R++ D++ U' / R++ D++ R-- D++ R-- D-- R-- D++ R++ D-- U,R-- D-- R++ D++ R++ D++ R++ D-- R++ D-- U' / R-- D++ R-- D++ R-- D-- R-- D++ R++ D++ U' / R-- D-- R-- D-- R++ D++ R++ D-- R-- D++ U'
Redi,R' L R x L R' L R L' R x L' R L' R' L' x L R L R' L R' x L' R' L' R L' x L' R' L R x R' L' R L' x L R' L,R L R' L x L' R' L' R' x L R L R L R x R' L' R L R' x R' L R L R' x R L R' L' R L' x L' R L' R' L' R' x L' R' L' R L',L R' L R L x R L R' L x L R' L R' L R' x R L R L x L R L' R L' x R' L' R L R' L' x L R' L' R' x L' R' L' R',R' L R' L R' L' x R L' R L' R x R' L' R' x R' L' R' x R' L' R' x R L R L R' L' x R' L' R' L' x L' R L',L R' L R' L R' x R' L' R' L x L R L x L R' L' R' L' x L' R L x L R L' R' x R L R L' x L' R L R' L' R'
