Clock,UR6+ DR3- DL3- UL2- U1- R2- D0+ L1+ ALL2- y2 U4+ R3- D5- L0+ ALL4+ UL,UR1- DR2+ DL5- UL0+ U0+ R5- D1+ L5+ ALL5+ y2 U1- R4+ D6+ L2- ALL5+ DR DL,UR2- DR1+ DL1+ UL6+ U2+ R3+ D4+ L2+ ALL5+ y2 U3- R5- D2- L3- ALL2- DR,UR2+ DR4- DL5+ UL2+ U3+ R3+ D4- L1- ALL2- y2 U4+ R5- D0+ L1+ ALL5+ UR DR UL,UR6+ DR4+ DL3- UL3- U5+ R4- D3- L3+ ALL0+ y2 U3+ R4+ D5+ L1+ ALL6+ DR DL
Mirror3x3,L' D2 L' D2 F2 R' F2 U2 L F2 R2 D' B' D' F U B2 R' U L F,D2 B U2 F R2 F2 L2 U2 L2 F' D2 L' U F U2 B D R2 B' L2 U',L2 D2 B2 L2 F D2 B D2 U2 R2 B D B L R' F2 D R2 B2 R,D2 R B2 L' D2 R U2 L' U2 L2 F2 D B L' R' F2 L2 F L F2 D,D2 F' R2 B L2 B2 D2 B2 F' D2 F D' U2 F D2 L' B F2 U B2 L2
Floppy,R2 F2 B2 R2 F2 R2 F2 R2 L2 B2 L2 B2 F2 R2 B2 ,L2 B2 L2 B2 L2 R2 F2 B2 L2 B2 F2 L2 F2 L2 B2 ,B2 F2 R2 L2 F2 L2 B2 L2 R2 F2 R2 L2 F2 B2 R2 ,B2 F2 L2 B2 L2 F2 B2 L2 F2 L2 F2 L2 B2 L2 B2 ,F2 B2 R2 F2 R2 L2 B2 F2 R2 B2 L2 F2 R2 F2 R2 
SuperFloppy,L' R B F2 R F2 B2 R2 L2 B' L F2 B R' F' R F R' F2 B2 ,B' F2 L2 R2 F2 B' L2 R B L2 R' B2 F R2 B' R' L' B' L B' ,B' F2 L2 B R F B2 R L F B' R2 L2 B' R' B2 R' L' B2 L' ,L R B' L' B R2 B2 R' F2 R F2 L' B2 R' B F R2 L2 F2 B2 ,L F' B L F L' R' F L B L' F2 L2 B F R2 B R B' F' 
FloppyGhost,UL2 UR2 U2 DL2 UL2 UR2 DR2 DL2 UR2 UL2 DR2 DL2 DR2 UL2 UR2 U2 DR2 DL2 UR2 DR2 ,DL2 UL2 DR2 U2 DL2 UL2 U2 UL2 DR2 UR2 DL2 U2 UR2 UL2 U2 UR2 UL2 DR2 DL2 DR2 ,DL2 UR2 DR2 U2 UR2 DL2 DR2 U2 UL2 U2 DL2 DR2 DL2 DR2 UL2 U2 DL2 UL2 DL2 DR2 ,DR2 U2 DL2 DR2 UR2 DL2 U2 UL2 DL2 DR2 UL2 U2 UR2 DR2 U2 UL2 UR2 DR2 DL2 UL2 ,U2 UL2 DL2 UL2 UR2 U2 UL2 UR2 DR2 DL2 DR2 UR2 DL2 UL2 DR2 UR2 DL2 DR2 UL2 U2 
Void,F D2 F R2 D2 L2 F2 D2 B F2 R2 U L R' D F' D2 B D2 B2 Rw2 Uw2,B' F' L2 U2 L2 D2 R2 F R2 B2 F' U' B R' F2 L' D F2 U' Fw' Uw,R2 B2 U' B2 R2 D F2 R2 B2 U' R2 F' L D R' B2 R2 B F' L D2 Rw2,D2 L2 U2 L2 U2 F2 L2 B' R2 F' D2 U L' F U2 B R F D2 U B2 Rw2,R U2 R2 U2 L' U2 F2 R F2 L' R' F D R' D2 B' R' F R' U' Rw2 Uw2
Kilominx,R++ D++ R++ D++ R++ D-- R-- D-- R++ D++ U' / R++ D-- R-- D-- R-- D-- R++ D++ R-- D-- U / R++ D++ R-- D++ R-- D-- R-- D++ R-- D-- U,R-- D-- R-- D++ R++ D-- R++ D-- R-- D++ U / R++ D++ R++ D++ R++ D-- R-- D++ R-- D++ U / R-- D++ R-- D++ R++ D-- R-- D++ R++ D-- U',R++ D++ R++ D++ R++ D++ R-- D++ R++ D-- U' / R-- D++ R++ D-- R-- D-- R++ D-- R++ D-- U / R-- D-- R++ D-- R++ D++ R++ D++ R++ D++ U,R++ D-- R-- D++ R-- D-- R-- D++ R++ D++ U' / R-- D++ R++ D++ R-- D-- R++ D-- R-- D-- U / R-- D++ R++ D-- R-- D++ R++ D++ R++ D-- U,R-- D++ R-- D++ R++ D-- R++ D-- R++ D-- U / R-- D++ R++ D-- R++ D-- R-- D++ R-- D-- U / R++ D-- R++ D-- R-- D-- R-- D++ R++ D-- U
Redi,L' R' L R' x L' R' L' R' x R L R x R' L' R L R' L' x L R L R L x L R L R L' x L R' L' x L R L' R',R L R' L' R L' x R' L' R' L R' L x R' L' R L' R x R L R' L' R' L x R L' R x R L R' L' R L' x L' R L' R L x L R' L,R' L R' x R L R' L' x R' L' R' x R' L R' L' R x L' R L' x L R L' R L R' x L' R L R x R L R' L' R L,L R L R x L R L R' L x R' L R' L x R L R' L R x L R' L R L' R x L' R' L' R L x L R' L' R' x L' R' L',R' L R' L R' L x R' L R L' R' x R' L R L' x R' L R L x R' L' R' L R' L x L' R' L' R' L x L' R' L x R' L' R
